<?xml version="1.0" encoding="UTF-8"?>
<!--<!DOCTYPE chassis SYSTEM "skin.dtd">-->
<chassis width="368" height="589" idiom="phone" device="simulator">
    <meta priority="70" info="Phone short Simulator" descr="An emulator-like short small screen resolution (320x480) skin"/>
    <image x="0" y="0" width="368" height="589" file="phone/chassis.png"/>
    <screen x="24" y="50" width="320" height="480"/>
    <led x="330" y="23" width="11" height="11" imageoff="phone/ledred.png" imageon="phone/ledgreen.png"/>
    <power x="20" y="16" width="23" height="23" imagedown="phone/power_down.png" imageup="phone/power_up.png"/>
    <back x="54" y="531" width="38" height="38" imagedown="phone/back_down.png" imageup="phone/back_up.png"/>
    <home x="201" y="531" width="38" height="38" imagedown="phone/home_down.png" imageup="phone/home_up.png"/>
    <action x="273" y="531" width="38" height="38" imagedown="phone/action_down.png" imageup="phone/action_up.png"/>
</chassis>
